lang	sentence
hi	लड़की के पास एक गौरैया की उड़ान थी
hi	लड़की के पास एक चट्टान की उड़ान थी
hi	यह एक चर्च की तरह शांतिपूर्ण था।
hi	यह युद्ध के मैदान की तरह शांतिपूर्ण था।
hi	पत्ते घास की तरह हरे थे
hi	पत्तियाँ मिट्टी की तरह हरी थीं
hi	किराने के सामान की खरीदारी धूप वाले समुद्र तट पर गोले ढूंढ रही है
hi	किराने के सामान की खरीदारी एक पागल द्वारा बनाई गई सूची के साथ एक मेहतर शिकार है
hi	युद्ध गलत अंग का विच्छेदन है
hi	युद्ध आपके जीवन को बचाने के लिए एक अंगच्छेदन है
hi	यह वसंत ऋतु में घास की तरह हरा होता है
hi	यह भीषण गर्मी के दौरान घास की तरह हरी होती है
hi	यह सोते हुए पिल्ला की तरह शांतिपूर्ण है
hi	यह उतना ही शांतिपूर्ण है जितना कि 40 के दशक में यूरोपीय
hi	संगीत सायरन की तरह तेज था।
hi	संगीत फुसफुसाहट की तरह जोर से था।
hi	नौकरी एक शादी के आदमी के रूप में उपलब्ध है।
hi	नौकरियां स्नातक के रूप में उपलब्ध हैं।
hi	शांति एक इंसान की उड़ान है
hi	शांति एक मानव चल रहा है
hi	पौधे एक लोरी हैं
hi	पौधे एक जोरदार ड्रम हैं
hi	कार एक आंख वाले चूहे की तरह बदसूरत थी
hi	कार हंस की तरह बदसूरत थी
hi	वह आदमी राजकुमार की तरह सुंदर था
hi	वह आदमी एक होबो की तरह सुंदर था
hi	बातचीत एक कील के रूप में तेज थी
hi	बातचीत चट्टान की तरह तेज थी
hi	उसने इसे ऐसे खाया जैसे एक मोटा लड़का केक खाता है
hi	उसने इसे ऐसे खाया जैसे एक छोटा लड़का ब्रोकली खाता है
hi	उसने उसे ऐसे उठाया जैसे कोई माँ बच्चे को पकड़े हुए हो
hi	उसने इसे कंडोम पकड़े हुए प्लेबॉय की तरह उठाया
hi	वह एक वानर की तरह गणित की परीक्षा में भाग गया
hi	वह एक रॉकेट वैज्ञानिक की तरह गणित की परीक्षा में भाग गया
hi	भालू शेर की तरह भूखा था
hi	भालू कागज के टुकड़े की तरह भूखा था
hi	उस बातचीत में आपके करों को आंखों पर पट्टी बांधने में आसानी हुई।
hi	उस बातचीत में रविवार की सुबह की आसानी थी।
hi	उनकी बातचीत तोपखाने की बमबारी थी।
hi	उनकी बातचीत शब्दों से आलिंगन थी।
hi	कहानी एक दुःस्वप्न की तरह परेशान करने वाली थी
hi	कहानी एक नवजात पिल्ले की तरह परेशान करने वाली थी
hi	"वे जिस घर का खर्च उठा सकते थे
hi	"वे जिस घर का खर्च उठा सकते थे
hi	"जिन लोगों ने बच्चे को गाते हुए सुना
hi	"जिन लोगों ने बच्चे को गाते सुना
hi	वह एक परी की तरह गाती है
hi	वह एक बैल मेंढक की तरह गाती है
hi	HI की राय ठोस की तरह दृढ़ थी
hi	HI की राय कपास की गेंद की तरह दृढ़ थी
hi	पायलट ने विमान को ऐसे उतारा जैसे वह एक नवजात शिशु को संभाल रहा हो।
hi	पायलट ने विमान को ऐसे उतारा जैसे वह किसी रोलर कोस्टर पर हो।
hi	आदमी का व्यक्तित्व एक बेनी बेबी की तरह है
hi	आदमी का व्यक्तित्व एक ड्रिल सार्जेंट की तरह है
hi	पोस्टर इंद्रधनुष की तरह रंगीन था
hi	पोस्टर फुटपाथ की तरह रंगीन था
hi	वह एक ऊदबिलाव की तरह उत्सुक है
hi	वह एक सुस्ती की तरह उत्सुक है
hi	नाव की मोटर बड़बड़ाते हुए नशे में है
hi	नाव की मोटर गर्जना करने वाला शेर है
hi	वकील का प्रारंभिक तर्क एक रूसी उपन्यास था।
hi	वकील का शुरुआती तर्क एक हवाईअड्डा पेपरबैक था।
hi	घर में एक संग्रहालय की सफाई थी
hi	घर में पेंटबॉल के मैदान की सफाई थी
hi	अंगूर में पुराने खिलौने की ताजगी थी।
hi	अंगूर में गर्मियों की सुबह की ताजगी थी।
hi	खिलौने में निष्पादन का आनंद था
hi	खिलौने में रोलर कोस्टर का आनंद था
hi	फिल्म का संदेश एक कप पुदीने की चाय की तरह दिल को छू लेने वाला था
hi	फिल्म का संदेश पॉप्सिकल की तरह दिल को छू लेने वाला था
hi	किताब नाश्ते के लिए पेनकेक्स की तरह क्लासिक थी
hi	"यह किताब उतनी ही क्लासिक थी
hi	खिलौना इस साल से एक चौथाई जितना नया था।
hi	खिलौना उतना ही नया था जितना कि आपके जन्म के एक चौथाई वर्ष।
hi	औरत एक पेड़ जितनी लंबी थी
hi	औरत एक पैर की चौकी जितनी लंबी थी
hi	टॉम को रोबोट की खुशी थी।
hi	टॉम को एक कुत्ते की खुशी थी।
hi	फिल्म में ए कैन्यन की गहराई है।
hi	फिल्म में एक गड्ढे की गहराई है।
hi	फिल्म में ए वैली की गहराई है।
hi	फिल्म में ए फ्लैटलैंड की गहराई है।
hi	वह एक हाथी की तरह नाजुक थी
hi	वह बर्फ के टुकड़े की तरह नाजुक थी
hi	उसके खाने का स्वाद एक पुराने जूते की तरह था
hi	उसके खाने का स्वाद स्वर्ग से मन्ना जैसा था
hi	लड़के का नींबू पानी स्टैंड फॉर्च्यून 500 कंपनी जितना ही सफल रहा
hi	लड़के का नींबू पानी स्टैंड 1962 के न्यूयॉर्क मेट्स की तरह ही सफल रहा
hi	वह एक फिल्म स्टार के रूप में प्रसिद्ध हैं
hi	वह कूड़ेदान में रोच के रूप में प्रसिद्ध है
hi	वह एक प्रोम क्वीन की तरह फैंसी है
hi	वह डिश वाटर की तरह फैंसी है
hi	उसका चेहरा सूरज की तरह चमक रहा था
hi	उसका चेहरा धूल भरे दर्पण के प्रतिबिंब की तरह चमक रहा था
hi	वह एक वानर के आकार का था।
hi	वह एक चींटी के आकार का था।
hi	गाने में एक अमीबा की रचनात्मकता थी।
hi	गीत में लौवर के सभी चित्रों की रचनात्मकता थी।
hi	वह फिल्म 25 साल के टैपवार्म जितनी लंबी थी
hi	वह फिल्म होवी मंडेल के बालों जितनी लंबी थी
hi	खेल का मैदान उतना ही सुरक्षित है जितना कि ड्रैकुला के नुकीले।
hi	खेल का मैदान बीमा पॉलिसी जितना ही सुरक्षित है।
hi	मैनेजर ने हमारी चिंगारी को और भी तेज कर दिया।
hi	मैनेजर ने हमारी चिंगारी में पानी डाला।
hi	छात्र एक उद्यमी के रूप में प्रतिभाशाली था
hi	छात्र एक अंधे ऊदबिलाव के रूप में प्रतिभाशाली था
hi	फिल्म स्टार की तरह ग्लैमरस थी ये महिला
hi	औरत पुराने जूते की तरह ग्लैमरस थी
hi	उसकी ऊंचाई एक लाल लकड़ी के पेड़ के बराबर थी
hi	उसकी ऊंचाई एक चूहे के बराबर थी
hi	वह जिराफ के साथ आंखों के स्तर तक आ गई
hi	वह एक बच्चे के साथ आंखों के स्तर तक आई
hi	रेस्तरां की प्लेट डू पत्रिकाएं देवताओं का अमृत थीं
hi	रेस्टोरेंट की प्लाट डू पत्रिकाओं में गर्म कचरा था
hi	कार बिना पानी वाले पूल के समान उपयोगी थी
hi	रात के खाने के दौरान कार चांदी के बर्तन की तरह उपयोगी थी
hi	मेरा कुत्ता मेफ्लाई की तरह खाता है
hi	मेरा कुत्ता टैरारे की तरह खाता है
hi	वह फिल्म 2013 में एक्सबॉक्स वन के लॉन्च जितनी विनाशकारी थी
hi	वह फिल्म अब्राहम लिंकन प्रेसीडेंसी जितनी विनाशकारी थी
hi	अवधारणा एक तले हुए अंडे की तरह भ्रमित करने वाली थी
hi	अवधारणा एक किडी पहेली के रूप में भ्रमित करने वाली थी
hi	बरिटो में ज्वालामुखी की गर्मी होती है
hi	बरिटो में हिमखंड की गर्मी होती है
hi	समय घोंघे की तरह घूमता रहा।
hi	समय चीते की तरह घूमता रहा।
hi	आदमी के पास एक साधु का धैर्य है।
hi	आदमी के पास स्नान में बिल्ली का धैर्य है।
hi	कला इंद्रधनुष की तरह रंगीन है
hi	कला बादलों के आकाश की तरह रंगीन है
hi	आदमी का सिर कला के काम की तरह सुंदर था
hi	आदमी का सिर कूड़ेदान की तरह सुंदर था
hi	इमारत उतनी ही पुरानी है जितनी खुद ब्रह्मांड
hi	इमारत उतनी ही पुरानी है जितनी कि कल पैदा होने वाले बच्चे
hi	उस पंखे में यूनानी देवता आयोलस की उड़ाने की शक्ति है
hi	उस पंखे में एक अनप्लग्ड हेअर ड्रायर की उड़ाने की शक्ति होती है
hi	सैंडविच का मांस एक टॉलेट की तरह नम था
hi	सैंडविच का मांस सैंडपेपर की तरह नम था
hi	वह एक लेडी बग जितनी बड़ी थी।
hi	वह हाथी जितनी बड़ी थी।
hi	भविष्य में मिट्टी के पोखर की चमक थी
hi	भविष्य में थी हीरे की चमक
hi	शैंपेन की बोतल की तरह फूट पड़ी लड़की की खुशी
hi	लोरी की तरह फूट पड़ी बच्ची की खुशी
hi	समस्या एक टुत्सी रोल जितनी बड़ी थी
hi	समस्या अंटार्कटिका जितनी बड़ी थी
hi	जलती हुई माचिस की तीली थी लड़की का मिजाज
hi	लड़की का मिजाज लो टाइड था
hi	"जिस किताब को मैंने अभी-अभी पढ़ना समाप्त किया है
hi	जिस किताब को मैंने अभी पढ़ना समाप्त किया है वह मेरा नया बग स्मैशर है।
hi	सांप के पास एक रेगिस्तानी निवासी की त्वचा होती है जिसने कभी लोशन की बोतल को नहीं छुआ है
