lang	sentence
hi	किताब पानी की बूंदों को गिनने की तरह दिलचस्प है
hi	यह किताब समय यात्रा की तरह दिलचस्प है।
hi	तारीख में एक विदेशी कहानी का सारा जादू था
hi	तारीख में एक वर्गीकृत विज्ञापन का सारा जादू था
hi	फोटोग्राफी एक कुरकुरा शरद ऋतु के दिन सूर्योदय की तरह सुंदर है
hi	फोटोग्राफी कूड़े के ढेर की तरह खूबसूरत है
hi	जोकर के पास बिल्ली की तरह मुस्कान है जिसने अभी-अभी एक चूहा पकड़ा है
hi	विदूषक की मुस्कान कठपुतली की तरह होती है
hi	वह उसे एक पूर्ण डायपर के रूप में उच्च मानती है
hi	वह उसे हीरे की तरह उच्च मानती है
hi	उसकी माँ के शब्द कचरे से अटे पड़े थे।
hi	उसकी माँ के वचन रत्नों से अटे पड़े थे।
hi	भीड़ भेड़ियों से भरी हुई थी।
hi	भीड़ भेड़ों से भरी हुई थी।
hi	वह चूहे की तरह खाता है।
hi	वह कुत्ते की तरह खाता है।
hi	खरगोश के पास चिनचिला के साथ क्रॉसब्रेड ईडर डक की कोमलता थी
hi	5 बजे की परछाई वाले आदमी के चेहरे पर खरगोश के चेहरे की कोमलता थी
hi	शिक्षिका अपने क्रश के साथ डेट पर एक लड़की की तरह खुश थी
hi	शिक्षक कचहरी में जज की तरह खुश था
hi	पूरी श्रृंखला में एक पोखर की गहराई थी।
hi	पूरी श्रृंखला में एक झील की गहराई थी।
hi	हवा में पूर्व-औद्योगिक चीन की सफाई थी
hi	हवा में एक ताजा खुले निर्वात की सफाई थी
hi	वह एक ऊदबिलाव की तरह व्यस्त है।
hi	वह एक सुस्ती की तरह व्यस्त है।
hi	वह गीत पक्षी की तरह गाती है।
hi	वह एक गरजती बिल्ली की तरह गाती है।
hi	वह बंद दरवाजे की तरह खुला है।
hi	वह एक बड़े मॉल की तरह खुला है।
hi	उनकी मनोदशा में सूर्य का स्थायित्व था।
hi	उनकी मनोदशा में ज्वार का स्थायित्व था।
hi	वह ऐनी फ्रैंक की तरह छिप रही थी
hi	वह सर्कस के जोकर की तरह छिप रही थी
hi	वे तथ्य बाइबल की तरह थे
hi	वो तथ्य शब्दकोश की तरह थे
hi	खेल का अंतिम स्कोर कुत्ते की पूंछ पर बालों की तुलना में करीब था।
hi	खेल का अंतिम स्कोर एक फ़ुटबॉल मैदान पर दो गोल पोस्ट से अधिक होने पर समाप्त हुआ।
hi	तथ्यों ने मामले को चोर के झूठ की तरह सत्यापित किया
hi	तथ्यों ने मामले को एक ठोस शर्लक होम्स मामले की तरह सत्यापित किया
hi	हँसी आत्मा के लिए संगीत की तरह है।
hi	हंसी चॉकबोर्ड पर चीखने जैसी है।
hi	तथ्य अचल शिलाखंड हैं।
hi	तथ्य तरल हैं।
hi	उनका पुस्तकालय एक मस्तिष्क था।
hi	उनका पुस्तकालय धुएं का गुबार था।
hi	उसका चेहरा एक गड्ढा है।
hi	उसका चेहरा एक आइस रिंक है।
hi	चालक लकड़हारा है।
hi	ड्राइवर एक बैलेरीना है।
hi	बंदर एक आधुनिक एडिसन था
hi	बंदर पहली कक्षा का ड्रॉपआउट था
hi	धार्मिक अनुभव होने के बाद उनके पास पोप का विवेक है
hi	बुरे दिन में उसके पास हिटलर का ज़मीर है
hi	कैंडी रैपर में हॉट टब में भिगोने के बाद एक बूढ़ी औरत की झुर्रियां होती हैं
hi	कैंडी रैपर में बोटॉक्स इंजेक्शन के बाद सेलिब्रिटी के चेहरे पर झुर्रियां पड़ जाती हैं
hi	माइक्रोफोन मेंढक की तरह उछल-कूद करता है
hi	माइक्रोफोन कीचड़ की तरह उछल-कूद करता है
hi	स्त्री गीले पोछे की तरह कलात्मक होती है।
hi	महिला वैन गॉग की तरह कलात्मक है।
hi	पार्किंग स्थल एक गड्ढा है।
hi	पार्किंग स्थल कांच की एक शीट है।
hi	पंच ने मुझे मार्शमैलो की ताकत से मारा
hi	मुक्के ने मुझे पत्थर की ताकत से मारा
hi	चिड़िया का पंख हमेशा के लिए चलता है
hi	पक्षी के पंखों का फैलाव तितली के पंख जितना छोटा होता है
hi	क्लास गीले पेपर बैग की तरह दिलचस्प थी।
hi	कक्षा इतनी उत्तेजक थी कि मुझे पुनर्जन्म का अहसास हुआ।
hi	उसकी आवाज सुबह-सुबह कॉफी थी।
hi	उसकी आवाज एक सुबह का अलार्म था।
hi	कुत्ते वफादारी और प्यार से भरी जिंदगी होते हैं।
hi	कुत्ते भीख मांग रहे हैं और जीवनदान दे रहे हैं।
hi	वह आदमी जे. क्रू मॉडल जितना ही सुंदर था
hi	वह आदमी एक नग्न तिल चूहे की तरह सुंदर था
hi	उसका चेहरा एक गंदगी सड़क है।
hi	उसका चेहरा कांच की चादर है।
hi	चित्रकार एक विध्वंस डर्बी है।
hi	चित्रकार एक सर्जन है।
hi	मैट की प्रेमिका एक वेंडिंग मशीन है।
hi	मैट की प्रेमिका एक पीओ है। डिब्बा।
hi	इस टेबल को एक ग्रीक गॉड ने बनाया है।
hi	इस टेबल को एक चिंपैंजी ने बनाया है।
hi	बच्चे का कमरा कूड़े का ढेर था
hi	बच्चे का कमरा प्री-सर्जिकल अस्पताल का कमरा था
hi	उसका दिमाग टूटी हुई कुर्सियों का एक सेट था
hi	उसका दिमाग एक विंटेज बुकशेल्फ़ था।
hi	आदमी ने एक न्यूरोसर्जन के रूप में अधिक कौशल के साथ परियोजना के लिए संपर्क किया
hi	उस व्यक्ति ने एक मिडिल स्कूल के छात्र के रूप में उतने ही कौशल के साथ परियोजना के लिए संपर्क किया
hi	ट्रैफिक में फंसी कार की तरह तेजी से आगे बढ़ा शख्स
hi	वह आदमी नियाग्रा फॉल्स की तरह तेजी से आगे बढ़ा
hi	उसने मुझसे ऐसे बात की जैसे मैं उसे पैसे देने जा रहा हूं।
hi	उसने मुझसे ऐसे बात की जैसे उसने सोचा था कि मैं पैसे माँगने जा रहा हूँ।
hi	यह बर्फ के तूफान में बर्फ के घन के रूप में उपयोगी है।
hi	यह लगभग उतना ही उपयोगी है जितना कि एक बर्फीले तूफान में गर्म केबिन।
hi	गद्दा ग्रेनाइट की तरह नरम था
hi	गद्दा बादल की तरह नरम था
hi	साबुन से लिली के खेत की तरह महक आ रही थी
hi	साबुन से जंगली जानवर के गोबर की तरह महक आ रही थी।
hi	हमारे पास ब्रह्मांड के जीवन काल का सारा समय है
hi	हमारे पास एक घरेलू मक्खी के जीवन भर का समय है
hi	संस्कृति में एक किडी पूल की गहराई है।
hi	संस्कृति में मारियाना ट्रेंच की गहराई है।
hi	सड़क चट्टानों का एक बिस्तर है।
hi	सड़क एक बर्फ की रिंक है।
hi	दही प्याज के छल्ले के घोल जैसा था
hi	दही धुंध की तरह था
hi	घरों पर मेसोनाइट साइडिंग पानी के साथ-साथ स्पंज को भी पीछे हटाती है
hi	घरों पर मेसोनाइट साइडिंग पानी के साथ-साथ रेनकोट को भी पीछे हटाती है
hi	उनकी संस्कृति में एक घास के मैदान का खुलापन है
hi	उनकी संस्कृति में एक कोठरी का खुलापन है
hi	औरत के पास एक बाल्टी की उथलापन है
hi	औरत के पास है सागर की उथल-पुथल
hi	यह स्थान एक संग्रहालय के रूप में सुसंस्कृत है
hi	यह स्थान ट्रक स्टॉप के समान सुसंस्कृत है
hi	वह एक बॉडी बिल्डर की तरह मजबूत है
hi	वह दादाजी की तरह मजबूत है
hi	फेस क्रीम में बजरी की बनावट होती है।
hi	फेस क्रीम में चॉकलेट मूस की बनावट होती है।
hi	कुत्ता सुनहरी मछली की तरह शातिर है
hi	कुत्ता भूखे भालू की तरह शातिर है
hi	कोहरा लोहे की तरह घना है
hi	कोहरा plexiglass जितना घना है
hi	एक पुजारी 9.1 भूकंप जितनी बार यौन रूप से सक्रिय होता है
hi	एक पुजारी माउंट सेंट हेलेंस की तरह यौन रूप से सक्रिय है
hi	डॉक्टर के पास स्टार ट्रेक में एक कंप्यूटर का दिमाग है
hi	डॉक्टर के पास एक अविकसित कबूतर का दिमाग है
hi	हॉलीवुड एक्ट्रेस की तरह डिमांडिंग थी ये लड़की
hi	लड़की सूप रसोई स्वयंसेवक के रूप में मांग कर रही थी
hi	"उसने जिन गहनों को गिरवी रखने की कोशिश की
hi	"उसने जिन गहनों को गिरवी रखने की कोशिश की
hi	उसके पास एक गोबर बीटल की सुंदरता थी
hi	वह एक शानदार फैशन मॉडल की सुंदरता रखती थी
hi	उन्हें एनएफएल खिलाड़ी की स्थिति मिली है।
hi	उसे विद्रूप की स्थिति मिल गई है।
hi	उनके पास एक बौद्ध भिक्षु का अनुशासन है।
hi	उसके पास एक जंगली लकड़बग्घा का अनुशासन है।
hi	काली मिर्च एक नरक है
hi	काली मिर्च एक आइस क्यूब है
hi	उसे एक पीटे हुए कुत्ते का सारा गुस्सा है
hi	उसके पास एक खुश तितली का सारा गुस्सा है
hi	उसके बालों में अप्रैल 2010 में मैक्सिको की खाड़ी का तेल है
hi	उसके बालों में डॉन डिश डिटर्जेंट का तेल है
hi	चर्च एक मनोगत बैठक के रूप में रूढ़िवादी था।
hi	चर्च उतना ही रूढ़िवादी था जितना कि प्राचीन चर्च के पिता।
hi	लड़की की जीभ तलवार की तरह तेज थी
hi	लड़की की जीभ तकिये की तरह तेज थी
hi	वह बुद्ध के समान आध्यात्मिक है
hi	वह मेरे कुत्ते की तरह आध्यात्मिक है
hi	उसके विचार घंटे के चश्मे में रेत की तरह बहते रहे
hi	उनके विचार ब्रेक डांस बंदर की तरह बहने लगे
hi	टैको बेल की रात में उनके कुंवारे पैड से एक फ्रैट डॉर्म बाथरूम की तरह ताज़ा महक आ रही थी
hi	उनके कुंवारे पैड से राल्फ लॉरेन खुशबू कारखाने की तरह ताजा महक आ रही थी
hi	मेरी आत्मा का वजन एक डॉलर के बिल जितना है
hi	मेरी आत्मा का वजन एक ट्रक के टायर जितना है
hi	ईश्वर से दर्शन पाकर उनके पास पोप की आध्यात्मिकता है
hi	उसके पास एक नास्तिक की आध्यात्मिकता है जो चर्चों को जला देता है
hi	फिल्म में सौ सूर्यों के जीवनकाल का क्रम था
hi	फिल्म में एक चींटी द्वारा एक मिनट में तय की गई दूरी का क्रम था
hi	डॉक्टर ततैया के झुंड की तरह मिलनसार है।
hi	डॉक्टर पिल्लों के एक पैकेट की तरह मिलनसार है।
hi	उनके भाषण में एक ऐसे व्यक्ति की तात्कालिकता थी जिसे पेशाब करना पड़ता है
hi	उनके भाषण में एक दूर की समय सीमा की तात्कालिकता थी
hi	कला का यह काम सुनहरी मछली की तरह शानदार है।
hi	कला का यह काम ताजमहल की तरह शानदार है।
hi	यह पोशाक ग्रेमलिन के एक पैकेट के योग्य है।
hi	यह पोशाक कैटवॉक के योग्य है।
hi	वे एक माउस और पनीर की तरह सहयोग करते हैं।
hi	वे एक चूहे और एक भूखी बिल्ली की तरह सहयोग करते हैं।
hi	उन्हें एक ड्रिल प्रशिक्षक का अनुशासन मिला है।
hi	उसे एक बच्चे का अनुशासन मिला है।
hi	उसके पास चीते की गति है।
hi	उसके पास सुस्ती की गति है।
hi	वह एक बूढ़ी गुस्सैल बिल्ली की तरह मिलनसार थी
hi	वह एक नवजात पिल्ले की तरह मिलनसार थी
hi	उसके पास A gnat . का ध्यान अवधि है
hi	उसके पास डॉल्फ़िन का ध्यान अवधि है
hi	घर प्राचीन मिस्र की एक ममी की उम्र है
hi	घर टॉम क्रूज़ अभिनीत द ममी का युग है
hi	कैन में शेफ बोयार्डी की पेंट्री के सारे नूडल्स हैं
hi	"कैन में भोजन के ""मजेदार आकार"" वाले हिस्से के सभी नूडल्स रखे जा सकते हैं"
hi	बैलेरीना में राजहंस की शान और शान थी।
hi	बैलेरीना में दरियाई घोड़े की शान और शान थी।
hi	कुत्ता उतना ही साहसी होता है जितना कायर सिंह।
hi	कुत्ता पूरी सेना की तरह साहसी होता है।
hi	गुब्बारे में पानी के नीचे एक्वामैन की तैरने की क्षमता थी
hi	गुब्बारे में जमीन पर एक्वामैन की तैरने की क्षमता थी
hi	धातु एक साँप की खाल है।
hi	धातु दर्पण है।
hi	यह जगह एक पार्टी की तरह हर्षित थी
hi	यह स्थान अंतिम संस्कार की तरह हर्षित था
hi	यह तली हुई बेकन की तरह कुरकुरी है!
hi	यह कच्चे बेकन की तरह खस्ता है!
hi	वह लाल पांडा की तरह प्यारा है!
hi	वह एक ब्लॉबफिश की तरह प्यारा है।
hi	धातु में हरक्यूलिस की ताकत है।
hi	धातु में गीले परी बाल पास्ता नूडल की ताकत होती है।
hi	मैं इस परियोजना के साथ समय बिताना चाहता हूं जैसे कि यह मेरा दुश्मन था
hi	मैं इस परियोजना के साथ समय बिताना चाहता हूं जैसे कि यह मेरा खेल था
hi	परियोजना मेरे दुश्मन के रूप में अनुकूल है
hi	परियोजना मेरे खेल की तरह ही अनुकूल है
hi	वह उत्तर तारे की तरह चमकीला है।
hi	वह एक मृत बल्ब की तरह चमकीला है।
hi	खरगोश के पास रेसकार की गति होती है
hi	खरगोश में सुस्ती की गति होती है
hi	बत्तख में एक रेसकार की तरह शोर था जो हर बार घास के एक ब्लेड से गुजरता है
hi	बत्तख के पास पेपरवेट के नीचे कागजों के ढेर का सारा शोर था
hi	उस स्त्री के पास बहाते हुए साँप की खाल है।
hi	उस महिला के पास कांच के टुकड़े की त्वचा है।
hi	उपन्यास में बोआ कंस्ट्रिक्टर की भावनात्मक सापेक्षता है।
hi	उपन्यास में एक पुराने मित्र की भावनात्मक सापेक्षता है।
hi	घर ग्रैंड कैन्यन जितना बड़ा है
hi	घर चूहादानी जितना बड़ा है
hi	फिल्म में एक डिक और जेन किताब की गहराई है
hi	फिल्म में शेक्सपियर के नाटक की गहराई है
hi	"औसत व्यक्ति में एक जटिल
hi	"औसत व्यक्ति में ठंड
hi	"स्पंज में ""ऑल यू कैन ईट"" बुफे में एक मोटे आदमी का अवशोषण होता है"
hi	स्पंज में टॉयलेट पेपर के एक-प्लाई के टुकड़े का अवशोषण होता है
hi	सीईओ का विचार भावनाओं के साथ रोबोट के रूप में अत्याधुनिक था
hi	सीईओ का विचार माईस्पेस जितना ही अत्याधुनिक था
hi	लड़की गूगल की तरह ही ज्ञानी थी
hi	लड़की अप्रशिक्षित पिल्ला जितनी ही ज्ञानी थी
hi	पीटर जूते पहनते हैं जिन्हें समुद्र में जाने वाले जहाजों के रूप में वर्गीकृत किया जा सकता है।
hi	पीटर जूते पहनता है जो एक योगिनी को फिट कर सकता है।
hi	मेक्सिको सिटी का वातावरण सौना है
hi	मेक्सिको सिटी का माहौल शीशे का है
hi	फूल में है माँ के चुम्बन की महक
hi	फूल में है शैतान के चुम्बन की सुगंध
hi	रिश्ते की लंबाई एक मैराथन थी
hi	रिश्ते की लंबाई थी पेपर क्लिप
hi	जॉर्ज ने एक टन ईंटों की तरह जमीन पर प्रहार किया
hi	जॉर्ज ने पंख की तरह जमीन पर प्रहार किया
hi	फिल्म में एक आयामी कार्टून चरित्र की गहराई है।
hi	फिल्म में बाहरी अंतरिक्ष के एक सर्वव्यापी ब्लैक होल की गहराई है।
