lang	sentence
hi	"सूरज ने सुबह अपने दरवाजे खोले और अपनी लंबी भुजाओं से मेरे आस-पास के वातावरण को उज्ज्वल कर दिया
hi	सूरज ने सुबह अपने दरवाजे खोले और अपनी लंबी भुजाओं से मुझे इसकी तीव्रता से अंधा कर दिया और मेरी पसीने से तर त्वचा को जला दिया
hi	मेरे पास एक चिपमंक की संगीत क्षमता है
hi	मेरे पास एक गीतकार की संगीत क्षमता है
hi	कंप्यूटर किसी का सबसे अच्छा दोस्त हो सकता है
hi	कंप्यूटर किसी का कड़वी दुश्मन हो सकता है
hi	समुद्र तट रेगिस्तान की तरह गर्म था
hi	समुद्र तट एक हिमखंड की तरह गर्म था
hi	जहाज चट्टान की तरह तेजी से नीचे गिरा
hi	जहाज तैरते पंख की तरह तेजी से नीचे उतरा
hi	उसे एक हिरण की कृपा जंगल में चली गई
hi	उसे रोलर ब्लेड पर एक दरियाई घोड़े की कृपा थी
hi	यह बिस्तर टूटे शीशे से अटे फुटपाथ की तरह नरम है
hi	यह बिस्तर एक फारसी बिल्ली की तरह नरम है
hi	ये जूते लाल-गर्म वाइस क्लैंप की एक जोड़ी की तरह महसूस करते हैं
hi	ये जूते जादू के कालीनों की एक जोड़ी की तरह लगते हैं
hi	इस पेड़ में एक पनीर ग्रेटर की छाल होती है
hi	इस पेड़ में एक फायरमैन के डंडे की छाल होती है
hi	उसके रंगों का संयोजन एक ट्रेन के पटरी से उतरने के बाद की याद दिलाता था।
hi	उसका रंग संयोजन महान आचार्यों के चित्रों की याद दिलाता था।
hi	टेस्ट ए-बी-सी जितना आसान था
hi	परीक्षण एक जानवर था
hi	उस आदमी के पास एक दुष्ट प्रतिभा की बुद्धि है
hi	उस आदमी के पास फील्ड माउस की बुद्धि है
hi	ईमेल कछुए की तरह तेज़ होते हैं
hi	ईमेल रॉकेट की तरह तेज़ होते हैं
hi	रात का खाना चमड़े के जूते की तरह स्वादिष्ट था
hi	रात का खाना एक मिशेलिन स्टार की तरह स्वादिष्ट था
hi	व्याख्या साफ पानी की तरह थी
hi	व्याख्या कीचड़ की तरह थी
fr	La fille avait la légèreté d'un moineau
fr	La fille avait la légèreté d'un rocher
fr	C'était aussi paisible qu'une église.
fr	C'était aussi paisible qu'un champ de bataille.
fr	Les feuilles étaient aussi vertes que l'herbe
fr	Les feuilles étaient aussi vertes que la terre
fr	"Faire ses courses
fr	Faire l'épicerie est une chasse au trésor avec une liste créée par un fou
fr	La guerre est une amputation du mauvais membre
fr	La guerre est une amputation pour sauver ta vie
fr	C'est aussi vert que l'herbe au printemps
fr	C'est aussi vert que l'herbe pendant un été chaud
fr	C'est aussi paisible qu'un chiot endormi
fr	C'est aussi paisible que l'européen dans les années 40
fr	La musique était forte comme une sirène.
fr	La musique était forte comme un murmure.
fr	Les emplois sont aussi disponibles qu'un homme marié.
fr	Les emplois sont aussi disponibles qu'un baccalauréat.
fr	La paix est un vol humain
fr	La paix est une marche humaine
fr	Les plantes sont une berceuse
fr	Les plantes sont un tambour bruyant
fr	La voiture était aussi laide qu'un rat borgne
fr	La voiture était aussi laide qu'un cygne
fr	L'homme était aussi beau qu'un prince
fr	L'homme était aussi beau qu'un clochard
fr	La conversation était vive comme un clou
fr	La conversation était tranchante comme un roc
fr	Il l'a mangé comme un gros garçon mange du gâteau
fr	Il l'a mangé comme un jeune garçon mange du brocoli
fr	Il l'a ramassé comme une mère tenant un bébé
fr	Il l'a ramassé comme un playboy tenant un préservatif
fr	Il s'est précipité à travers le test de mathématiques comme un singe
fr	Il s'est précipité à travers le test de mathématiques comme un spécialiste des fusées
fr	L'ours avait aussi faim qu'un lion
fr	L'ours avait aussi faim qu'un morceau de papier
fr	Cette conversation avait la facilité de faire vos impôts les yeux bandés.
fr	Cette conversation avait l'aisance d'un dimanche matin.
fr	Leurs conversations étaient des bombardements d'artillerie.
fr	Leurs conversations étaient un câlin avec des mots.
fr	L'histoire était aussi dérangeante qu'un cauchemar
fr	L'histoire était aussi dérangeante qu'un chiot nouveau-né
fr	Leurs attentes concernant la maison qu'ils pouvaient s'offrir se sont transformées en glace fondue.
fr	Leurs attentes concernant la maison qu'ils pouvaient s'offrir dépassèrent le deuxième étage.
fr	Ceux qui ont entendu l'enfant chanter ont été emportés par de douces vagues.
fr	Ceux qui ont entendu l'enfant chanter ont été torturés par les notes intrusives.
fr	Elle chante comme un ange
fr	Elle chante comme une grenouille taureau
fr	Ses opinions étaient aussi fermes que concrètes
fr	Ses opinions étaient aussi fermes qu'une boule de coton
fr	Le pilote a fait atterrir l'avion comme s'il manipulait un nouveau-né.
fr	Le pilote a fait atterrir l'avion comme s'il était sur des montagnes russes.
fr	La personnalité de l'homme est comme un Beanie Baby
fr	La personnalité de l'homme est comme un sergent instructeur
fr	L'affiche était aussi colorée qu'un arc-en-ciel
fr	L'affiche était aussi colorée qu'un trottoir
fr	Elle est aussi impatiente qu'un castor
fr	Elle est aussi impatiente qu'un paresseux
fr	Le moteur du bateau est un babillage ivre
fr	Le moteur du bateau est un lion rugissant
fr	L'argument d'ouverture de l'avocat était un roman russe.
fr	L'argument d'ouverture de l'avocat était un livre de poche d'aéroport.
fr	La maison avait la propreté d'un musée
fr	La maison avait la propreté d'un terrain de paintball
fr	Les raisins avaient la fraîcheur d'un jouet d'occasion.
fr	Les raisins avaient la fraîcheur d'un petit matin d'été.
fr	Le jouet avait la jouissance d'une exécution
fr	Le jouet avait le plaisir des montagnes russes
fr	Le message du film était aussi réconfortant qu'une tasse de thé à la menthe
fr	Le message du film était aussi réconfortant qu'un Popsicle
fr	Le livre était aussi classique que des pancakes pour le petit déjeuner
fr	Le livre était aussi classique qu'une mariée vêtue de violet
fr	Le jouet était aussi neuf qu'un quart de cette année.
fr	Le jouet était aussi neuf qu'un quart de l'année de votre naissance.
fr	La femme était aussi grande qu'un arbre
fr	La femme était aussi grande qu'un tabouret
fr	Tom avait la joie d'un robot.
fr	Tom avait la joie d'un chien.
fr	Le film a une profondeur de A canyon.
fr	Le film a une profondeur de A nid de poule.
fr	Le film a une profondeur de vallée A.
fr	Le film a une profondeur de A flatland.
fr	Elle était aussi délicate qu'un éléphant
fr	Elle était aussi délicate qu'un flocon de neige
fr	Son dîner avait le goût d'une vieille chaussure
fr	Son dîner avait le goût de la manne du paradis
fr	Le stand de limonade du garçon a eu autant de succès qu'une entreprise du Fortune 500
fr	Le stand de limonade du garçon a eu autant de succès que les Mets de New York de 1962
fr	Il est aussi célèbre qu'une star de cinéma
fr	Il est aussi célèbre qu'un cafard dans une benne à ordures
fr	Elle est aussi chic qu'une reine de bal
fr	Elle est aussi chic que l'eau de vaisselle
fr	Son visage brillait comme le soleil
fr	Son visage brillait comme le reflet d'un miroir poussiéreux
fr	Il avait la taille d'un singe.
fr	Il avait la taille d'une fourmi.
fr	La chanson avait la créativité d'une amibe.
fr	La chanson avait la créativité de tous les tableaux du Louvre.
fr	Ce film était aussi long qu'un ténia de 25 ans
fr	Ce film était aussi long que les cheveux de Howie Mandel
fr	Le terrain de jeu est aussi sûr que les crocs de Dracula.
fr	Le terrain de jeu est aussi sûr qu'une police d'assurance.
fr	Le directeur a ajouté du petit bois à notre étincelle.
fr	Le directeur a ajouté de l'eau à notre étincelle.
fr	L'étudiant était aussi doué qu'un entrepreneur
fr	L'élève était aussi doué qu'une loutre aveugle
fr	La femme était aussi glamour qu'une star de cinéma
fr	La femme était aussi glamour qu'une vieille chaussure
fr	Sa taille était comparable à un séquoia
fr	Sa taille était comparable à celle d'une souris
fr	Elle est venue au niveau des yeux avec une girafe
fr	Elle est venue au niveau des yeux avec un enfant en bas âge
fr	Le plat du jour du restaurant était l'ambroisie des dieux
fr	Le plat du jour du restaurant était une poubelle chaude
fr	La voiture était aussi utile qu'une piscine sans eau
fr	La voiture était aussi utile que l'argenterie pendant le dîner
fr	Mon chien mange comme un éphémère
fr	Mon chien mange comme un tarrare
fr	Ce film aussi désastreux que le lancement de la Xbox One en 2013
fr	Ce film aussi désastreux que la présidence d'Abraham Lincoln
fr	Le concept était aussi déroutant qu'un œuf brouillé
fr	Le concept était aussi déroutant qu'un puzzle pour enfants
fr	Le burrito a la chaleur d'un volcan
fr	Le burrito a la chaleur d'un iceberg
fr	Le temps s'est déplacé comme un escargot.
fr	Le temps s'est déplacé comme un guépard.
fr	L'homme a la patience d'un moine.
fr	L'homme a la patience d'un chat dans un bain.
fr	L'art est aussi coloré qu'un arc-en-ciel
fr	L'art est aussi coloré qu'un ciel nuageux
fr	La tête de l'homme était aussi belle qu'une œuvre d'art
fr	La tête de l'homme était aussi belle qu'une poubelle
fr	Le bâtiment est aussi vieux que l'univers lui-même
fr	Le bâtiment est aussi vieux que le bébé qui naîtra demain
fr	Cet éventail a le pouvoir de souffler du dieu grec Aeolus
fr	Ce ventilateur a la puissance de soufflage d'un sèche-cheveux débranché
fr	La viande du sandwich était aussi humide qu'une serviette
fr	La viande du sandwich était aussi humide que du papier de verre
fr	Elle était grosse comme une coccinelle.
fr	Elle était aussi grosse qu'un éléphant.
fr	L'avenir avait l'éclat d'une flaque de boue
fr	L'avenir avait l'éclat du diamant
fr	Le bonheur de la fille a explosé comme une bouteille de champagne
fr	Le bonheur de la fille a explosé comme une berceuse
fr	Le problème était aussi gros qu'un Tootsie Roll
fr	Le problème était aussi grand que l'Antarctique
fr	Le tempérament de la fille était un match allumé
fr	Le tempérament de la fille était une marée basse
fr	Le livre que je viens de finir de lire est une boussole de ma vie.
fr	Le livre que je viens de finir de lire est mon nouveau bug smasher.
fr	Le serpent a la peau d'un habitant du désert qui n'a jamais touché une bouteille de lotion
fr	Le serpent a la peau d'une anguille aquatique visqueuse
fr	Le journaliste était aussi grand qu'un centre de basket
fr	Le journaliste était aussi grand qu'un nain
fr	La maladie se propage comme un feu sauvage
fr	La maladie se propage comme la pousse d'un ongle
fr	L'adolescent était un gratte-ciel
fr	L'adolescent était une fourmilière
fr	L'enquête avait le poids d'un bouquet de plumes
fr	L'enquête a eu le poids d'un effet d'entraînement à l'échelle de la ville
fr	Le professeur est aussi encourageant qu'un parent
fr	Le professeur est aussi encourageant qu'un oiseau mort
fr	Ses cheveux avaient l'éclat de la crinière alezan d'un cheval
fr	Ses cheveux avaient l'éclat de la paille
fr	Sa classe avait tout l'éclat d'une ampoule
fr	Sa classe avait tout l'éclat d'un rocher
fr	La maison était aussi confortable qu'une cabane d'hiver par une nuit froide.
fr	La maison était aussi confortable qu'une cellule de prison.
fr	Le soldat était dur comme des clous
fr	Le soldat était aussi dur que du coton
fr	Elle était aussi fragile qu'un éléphant
fr	Elle était aussi fragile qu'une tasse de thé en cristal
fr	Son parent le plus proche pourrait aussi bien être un cheval
fr	Son parent le plus proche pourrait aussi bien être un oiseau
fr	L'athlète était aussi bon que Mike Tyson dans les années 80
fr	L'athlète était aussi bon que Mike Tyson quand il avait 80 ans
fr	L'étudiant était aussi confus qu'un chien à un concours d'orthographe
fr	L'étudiant était aussi confus qu'un avocat au tribunal
fr	Le coin était aussi occupé qu'un défilé
fr	Le coin était aussi occupé qu'un cimetière
fr	Le livre était aussi divertissant qu'une fête
fr	Le livre était aussi divertissant qu'un enterrement
fr	L'artiste est aussi créatif qu'une glace à la vanille
fr	L'artiste est aussi créatif que la crème glacée au tourbillon balsamique au caramel
fr	Cette série compte autant d'épisodes qu'un mille-pattes a de pattes
fr	Cette émission compte autant d'épisodes qu'il y a de lunes dans le ciel nocturne
fr	Moi et mon parent avons la proximité de jumeaux siamois
fr	Moi et mon parent avons la proximité des pôles nord et sud
fr	La maison est aussi fragile que l'acier
fr	La maison est aussi fragile que la soie
fr	L'acteur a attiré autant d'attention qu'une exposition de lion dans un zoo
fr	L'acteur a attiré autant d'attention qu'un grain de sable sur une plage
fr	Cette chemise ressemble à un sac poubelle
fr	Cette chemise ressemble à un rosier
fr	Le livre a le respect d'un médecin
fr	Le livre a le respect d'un théoricien du complot
fr	Ma nouvelle voiture a la fiabilité d'un penny stock
fr	Ma nouvelle voiture a la fiabilité d'un piano bien réglé
fr	La fondation était plate comme une planche
fr	La fondation était plate comme un globe
fr	La voiture est aussi rapide qu'une tortue
fr	La voiture est aussi rapide qu'un éclair
fr	Il court plus vite qu'un guépard en jet
fr	Il court plus vite qu'un escargot mort
fr	Le tempérament de l'homme était un piment habanero
fr	L'humeur de l'homme était une tasse de lait d'avoine.
fr	Le gouvernement est aussi stable qu'un pont cassé
fr	Le gouvernement est aussi fort qu'une maison en brique
fr	Les chances de gagner à la loterie sont aussi bonnes que de trouver une aiguille dans une botte de foin
fr	Les chances de gagner à la loterie sont aussi bonnes que d'allumer une allumette et de s'attendre à un incendie.
fr	elle est aussi exubérante qu'un chien en voiture
fr	elle est aussi exubérante qu'un paresseux au lit
fr	Il est juste comme un prêtre
fr	Il est juste comme un diable
fr	La branche était aussi solide qu'une poutre en acier
fr	La branche était aussi solide qu'une brindille
fr	Cette chose aspire autant d'électricité qu'un réfrigérateur des années 1950
fr	Cette chose aspire autant d'électricité que la Wii U dans le placard
fr	La pièce a l'excitation d'une tortue endormie.
fr	Le jeu a l'excitation d'un jackpot de loterie.
fr	La fille est aussi prévisible que le fracas des vagues de l'océan
fr	La fille est aussi prévisible que le naufrage du Titanic
fr	L'homme a la hauteur d'une montagne
fr	L'homme a la hauteur d'un tabouret
fr	La maison est aussi enchanteresse qu'un château
fr	La maison est aussi enchanteresse que roadkill
fr	L'étudiant était aussi tranchant qu'un couteau émoussé
fr	L'étudiant était aussi pointu que la plume d'un porc-épic
fr	Sa voix chantante ressemble à des ongles sur un tableau noir
fr	Sa voix chantante ressemble à une brise chantante
fr	Les marchandises avaient la valeur de l'or
fr	Les marchandises étaient aussi précieuses que la saleté
fr	Le puzzle était aussi simple que la tarte
fr	Le puzzle était aussi simple qu'une opération au cerveau
fr	Le politicien était aussi populaire que la tarte aux pommes
fr	Le politicien était aussi populaire qu'un canal radiculaire
fr	La réunion fut aussi animée qu'un cortège funèbre.
fr	La réunion était aussi animée qu'un groupe d'enfants dans une maison gonflable.
fr	Il a acheté l'article comme une mariée choisissant sa robe
fr	Il a acheté l'article comme un voleur qui s'enfuit
fr	"Regarder le film
fr	"Regarder le film
fr	Le cookie était aussi moelleux qu'un Tootsie Roll
fr	Le cookie était aussi moelleux qu'une brique
fr	Le livreur de pizza avait la vitesse d'un sprinteur olympique
fr	Le livreur de pizza avait la vitesse d'une plaque tectonique
fr	Le rôti braisé a l'arôme de l'eau des marais.
fr	Le braisé a l'arôme de la cuisine d'une grand-mère.
fr	La photographie a la clarté d'un test de tache d'encre.
fr	La photographie a la clarté d'un arc-en-ciel complet.
fr	Il a les prouesses politiques d'un Kennedy
fr	Il a les prouesses politiques d'un nouveau-né
fr	Ce puzzle a la difficulté de mettre un homme sur Mars
fr	Ce puzzle a la difficulté d'un jeu de tri de blocs pour enfant
fr	Le garçon était aussi drôle qu'un comédien
fr	Le garçon était aussi drôle qu'une mouche morte
fr	Les excuses du politicien étaient un coup d'échecs.
fr	Les excuses du politicien ont été une avalanche.
fr	Il était aussi dangereux qu'une vipère
fr	Il était aussi dangereux qu'une puce
fr	L'eau était aussi chaude que la surface du soleil
fr	L'eau était aussi chaude qu'un glaçon
fr	Son excuse avait la conviction d'un soldat déserteur.
fr	Son excuse avait la conviction d'un prédicateur revivaliste.
fr	La menace était un train venant en sens inverse
fr	La menace était un troisième cousin trois fois éloigné
fr	Leur amour était aussi facile à comprendre qu'une parole de Bob Dylan.
fr	Leur amour était comme une saison des feux de forêt en Californie.
fr	Le livre a attiré mon attention comme un jargon juridique dans un accord de fusion
fr	Le livre a attiré mon attention comme un titre de magazine trash
fr	Ses pensées étaient comme un yo-yo
fr	Ses pensées étaient comme un ruisseau de source
fr	Son ego était un cracker Ritz
fr	Son ego était un bâtiment en brique
fr	Son esprit est une cage d'acier
fr	Son esprit est une porte de grange ouverte
fr	L'écran était sombre comme une lampe de poche.
fr	L'écran était sombre comme une bougie.
fr	Le discours de ce politicien était aussi bon que le discours de Gettysburg de Lincoln
fr	Le discours de ce politicien était aussi bon qu'une conférence dense d'un professeur d'université.
fr	tu es aussi dur qu'un oreiller
fr	tu es aussi dur que le roc
fr	Tu es aussi dur qu'un oeuf
fr	Tu es aussi dur qu'une noix de coco
fr	La fille est aussi douée pour camoufler ses émotions qu'un caméléon
fr	La fille est aussi douée pour camoufler ses émotions qu'un paon
fr	Mon compte bancaire est sec comme le Sahara
fr	Mon compte bancaire est bourré comme une dinde de Thanksgiving
fr	Le sandwich a le fromage de la lune comme représenté dans les dessins animés
fr	Le sandwich a le goût de fromage d'une pizza sans la garniture principale
fr	La tour a la résistance au vent d'une toiture métallique par beau temps
fr	La tour a la résistance au vent d'un emballage de bonbon pris dans un courant ascendant
fr	Le corps a la capacité de survie d'un tigre affamé dans un poulailler
fr	Le corps a la capacité de survie d'un sac en papier dans un océan orageux
fr	Elle a monté ce cheval comme un acrobate
fr	Elle a monté ce cheval comme une victime d'épilepsie
fr	Le discours était aussi inspirant qu'un bloc de ciment
fr	Le discours était aussi inspirant qu'un marathonien sans jambes
fr	Le verre est clair comme les instructions d'Ikea
fr	Le verre est transparent comme du papier saran
fr	Les cookies avaient le goût de hardtack.
fr	Les cookies avaient le goût du paradis.
fr	Le sol était aussi glissant que de l'huile
fr	Le sol était aussi glissant que du papier de verre
fr	La gemme était aussi fausse qu'un mauvais postiche
fr	Le joyau était aussi faux que l'air que nous respirons
fr	Les garçons sont aussi disciplinés que les militaires
fr	Les garçons sont aussi disciplinés que des singes barils
fr	L'hélicoptère avait la fiabilité d'une tour qui s'effondre.
fr	L'hélicoptère avait la fiabilité d'un cuirassé.
fr	Ce livre est comme de la soie dans mes mains.
fr	Ce livre est comme une amnésie à couverture rigide.
fr	La passion des équipes brûlait comme un enfer
fr	La passion des équipes brûlait comme une allumette
fr	L'épée était aussi tranchante qu'un laser
fr	L'épée était aussi tranchante qu'un bâton
fr	Il manœuvra avec la précision tactique d'un général expérimenté.
fr	Il manœuvrait avec la précision tactique d'une voiture de clown.
fr	La fin était aussi satisfaisante qu'un dîner de Thanksgiving avec tous les accompagnements.
fr	La fin était aussi satisfaisante qu'un biscuit salé rassis.
fr	Ce mec est aussi intelligent qu'un roc
fr	Ce mec est aussi intelligent qu'un ordinateur
fr	L'amitié était aussi significative qu'un contrat sur une serviette
fr	L'amitié était aussi significative qu'un traité international
fr	L'enfant était aussi immobile qu'une dalle de marbre
fr	L'enfant était aussi immobile qu'une chute d'eau
fr	Il est aussi fort qu'un diamant.
fr	Il est aussi fort qu'un morceau de graphite.
fr	Il a la satisfaction d'un maître cuisinier après avoir fait un repas 5 étoiles
fr	Il a la satisfaction d'un maître cuisinier après avoir fait un bol de conserve 🍝
fr	Elle avait le dévouement d'un moucheron
fr	Elle avait la dédicace d'une plaque tectonique
fr	Le désir qu'elle ressentait n'était qu'un filet
fr	Le désir qu'elle ressentait était une vague déferlante
fr	L'homme a le goût d'un enfant difficile.
fr	L'homme a le goût de la reine d'Angleterre.
fr	Le lit est aussi confortable que le nuage.
fr	Le lit est aussi confortable que de voir son ex.
fr	Elle a la patience d'une sainte
fr	Elle a la patience d'un taureau
fr	Il a la moralité d'un chiot.
fr	Il a la moralité d'un vautour.
fr	Son désir pour elle était un cheval en fuite.
fr	Son désir pour elle était un escargot.
fr	Il pourrait sprinter comme le vent
fr	Il pouvait sprinter comme une tortue
fr	Ils s'adaptent à la personnalité de l'autre comme une prise dans une prise
fr	Ils correspondent à la personnalité de l'autre comme un aimant sur papier
fr	Les spaghettis étaient aussi froids que le regard d'un professeur d'école paroissiale en colère
fr	Les spaghettis étaient aussi froids que des vacances à Hadès
fr	Son esprit était comme un coffre-fort
fr	Son esprit était comme le coffre à jouets d'un enfant
fr	Le fantôme a l'invisibilité d'un enfant du milieu timide avec un frère aîné surperformant et une sœur cadette sauvage et exubérante
