startphrase,ending1,ending2,labels
Àyì̀nlá dá Àjàlá lọ́lá,Àyìnlá yan Àjàlá jẹ,Àyìnlá ṣe òtítọ́ sí Àjàlá,0
Àyìnlá fá Àjàlá lórí,Àyìnlá yan Àjàlá jẹ,Àyìnlá ṣe òtítọ́ sí Àjàlá,1
"Àkókò ń sáré tete, a ò sí lè dúró de ẹnì kankan",Kò sí àkókò,Ọ̀pọ̀ àkòkò ló wà,0
"Àkókò ń fà bí i ìgbín, a ò sí lè dúró de ẹnì kankan",Kò sí àkókò,Ọ̀pọ̀ àkòkò ló wà,1
Omi gàrí tí mo mu lánàá kan bí i omi ògì,Omi gàrí náà kan gan,Omi gàrí náà ta lẹ́nu,0
Omi gàrí tí mo mu lánàá korò bí i àgbo,Omi gàrí náà kan gan,Omi gàrí náà ta lẹ́nu,1
Délaní mọ ọfà ta bí i àwọn ògbójú ọdẹ tafàtafà,Délaní mọ ọfà ta dáadáa,Délaní ò rí ẹyẹ pa,0
Délaní ò mọ ọfà ta bí i àwọn ògbójú ọdẹ,Délaní mọ ọfà ta dáadáa,Délaní ò rí ẹyẹ pa,1
