startphrase,ending1,ending2,labels
Mahasiswa iku nduweni julukan otak udang,Mahasiswa iku nduweni julukan wong sing bodho,Mahasiswa iku nduweni julukan wong sing pinter,0
Mahasiswa iku nduweni julukan otak encer,Mahasiswa iku nduweni julukan wong sing bodho,Mahasiswa iku nduweni julukan wong sing pinter,1
Pendukunge Pak Rangga dadi bupati kayata busa ing samodra,Pendukunge Pak Rangga dadi bupati Akeh,Pendukunge Pak Rangga dadi bupati sitik,0
Pendukunge Pak Rangga dadi bupati kayata jamaah sholat subuh ing masjid,Pendukunge Pak Rangga dadi bupati Akeh,Pendukunge Pak Rangga dadi bupati sitik,1
Warnane rambute kaya kembang jambu,Warna rambute putih,Warna rambute ireng,0
Warnane rambute kaya areng,Warna rambute putih,Warna rambute ireng,1
Bathuke Icha nyela cendhani,Bathuke Ica Rata,Bathuke Ica amba banget,0
Bathuke Icha nonong,Bathuke Ica Rata,Bathuke Ica amba banget,1
